影评	电影简介	电影名称	序号	星级	电影类型
					
115740人评价	没有了退路，只好飞向自由。	末路狂花	208	8.7	1991/美国法国/犯罪剧情惊悚
					
334901人评价	青春就是放弃和怀念。	秒速5厘米	209	8.3	2007/日本/动画剧情爱情
					
117960人评价	天使暂时离开。	绿里奇迹	210	8.7	1999/美国/犯罪剧情奇幻悬疑
					
113324人评价	在那片深蓝中，感受来自大海的忧伤寂寞与美丽自由。	碧海蓝天	211	8.7	1988/法国美国意大利/剧情爱情
					
96489人评价	日本的家庭电影已经是世界巅峰了，步履不停是巅峰中的佳作。	步履不停	212	8.8	2008/日本/剧情家庭
					
154118人评价	类型片的极致。 	勇闯夺命岛	213	8.6	1996/美国/动作冒险
					
50226人评价	永远的小人物，伟大的卓别林。	城市之光	214	9.2	1931/美国/喜剧剧情爱情
					
201073人评价	科幻真正的魅力不是视觉效果能取代的。 	这个男人来自地球	215	8.5	2007/美国/剧情科幻
					
508778人评价	黑小鸭速效美白记。	初恋这件小事	216	8.3	2010/泰国/剧情喜剧爱情
					
154073人评价	是枝裕和的家庭习作。	海街日记	217	8.7	2015/日本/剧情家庭
					
243842人评价	昆汀同学越来越变态了，比北野武还杜琪峰。	无耻混蛋	218	8.4	2009/美国德国/剧情犯罪
					
175921人评价	生命不止，摇滚不死。	海盗电台	219	8.6	2009/英国德国法国/剧情喜剧音乐
					
206100人评价	迪士尼和皮克斯拿错剧本的产物。	无敌破坏王	220	8.6	2012/美国/喜剧动画奇幻冒险
					
135899人评价	世界上有那么多女人那么多酒馆，但她偏偏走进我的这家。	卡萨布兰卡	221	8.6	1942/美国/剧情爱情战争
					
232398人评价	当发哥的风衣、墨镜出现在了凯奇身上??	变脸	222	8.4	1997/美国/动作科幻犯罪惊悚
					
130224人评价	所谓爱情，就是话唠一路，都不会心生腻烦，彼此嫌弃。	爱在午夜降临前	223	8.8	2013/美国/剧情爱情
					
169424人评价	生病的E.T.皮肤的颜色就像柿子饼。	E.T. 外星人	224	8.5	1982/美国/剧情科幻
					
353076人评价	中国版《两杆大烟枪》。	疯狂的石头	225	8.3	2006/中国大陆香港/喜剧犯罪
					
201318人评价	我完全康复了。	发条橙	226	8.5	1971/英国美国/犯罪剧情科幻
					
57248人评价	最棒的西部片。	黄金三镖客	227	9.1	1966/意大利西班牙西德/冒险西部
					
201225人评价	每个人的内心都是深不可测的大海。 	美国丽人	228	8.5	1999/美国/剧情爱情家庭
					
137969人评价	出门必备：本草纲目。	荒野生存	229	8.6	2007/美国/冒险传记剧情
					
186011人评价	"In memory, love lives forever..."	英国病人	230	8.5	1996/美国英国/爱情剧情战争
					
206107人评价	小成本大魅力。	彗星来的那一夜	231	8.4	2013/美国英国/科幻悬疑惊悚
					
54925人评价	最美的飞翔。	迁徙的鸟	232	9.1	2001/法国德国意大利西班牙瑞士/纪录片
					
148170人评价	每个美丽事物背后都是滴血的现实。	血钻	233	8.5	2006/美国德国/剧情惊悚冒险
					
370205人评价	皇上无话儿。	国王的演讲	234	8.3	2010/英国澳大利亚美国/剧情传记历史
					
141921人评价	新闻人的理性求真。	聚焦	235	8.8	2015/美国/剧情传记
					
127480人评价	我不信仰上帝，但我敬畏上帝。	非常嫌疑犯	236	8.6	1995/德国美国/剧情犯罪悬疑惊悚
					
113491人评价	现实与童话交相辉映的旅程。	燕尾蝶	237	8.6	1996/日本/犯罪剧情
					
94047人评价	热血沸腾，相当完美的娱乐拳击大餐。	勇士	238	8.9	2011/美国/剧情运动家庭
					
117280人评价	乐观比一切都有力量。	叫我第一名	239	8.6	2008/美国/剧情传记
					
254105人评价	大卫・林奇的梦境迷宫。	穆赫兰道	240	8.3	2001/法国美国/剧情悬疑惊悚
					
144912人评价	用剩余不多的时间，去燃烧整个生命。	遗愿清单	241	8.5	2007/美国/冒险喜剧剧情
					
129699人评价	还原真实而残酷的战争。	黑鹰坠落	242	8.6	2001/美国/动作历史战争
					
64616人评价	你要相信，这世上真的有爱存在，不管在什么年纪 	我爱你	243	9	2011/韩国/剧情爱情
					
109125人评价	一群演技精湛的戏骨，奉献出一个精致的黑帮小品，成就杜琪峰群戏的巅峰之作。	枪火	244	8.6	1999/香港/剧情动作犯罪
					
148823人评价	一个人的独角戏。	荒岛余生	245	8.5	2000/美国/冒险剧情
					
103320人评价	纯净原始的笑与感动。	上帝也疯狂	246	8.6	1980/博茨瓦纳南非/喜剧
					
104749人评价	捍卫人权只是信仰，一点不妨碍其行为的残忍。	大卫・戈尔的一生	247	8.6	2003/美国德国英国/剧情犯罪悬疑
					
95903人评价	一部能引人思考的科幻励志片。	千钧一发	248	8.7	1997/美国/剧情科幻惊悚
					
105013人评价	现代科幻电影的开山之作，最伟大导演的最伟大影片。	2001太空漫游	249	8.7	1968/英国美国/科幻惊悚冒险
					
288329人评价	青春的窃窃私语。 	蓝色大门	250	8.3	2002/台湾法国/剧情爱情同性
